{
  "last_session": "2026-10-29",
  "generated_utc": "2026-10-29T23:09:41.705867+00:00",
  "data_stale": false,
  "is_preview": true,
  "market": {
    "soxx_close": 513.8599853515625,
    "soxl_close": 102.38999938964844,
    "soxx_ret": -0.015481,
    "soxl_ret": -0.046204
  },
  "engine": {
    "rv20": 0.432791,
    "rv20_p90": 0.670366,
    "rules": {
      "R1": 1.0,
      "R2": 1.0,
      "R3": 1.0,
      "R4": 1.0
    },
    "ensemble": 1.0,
    "gate": {
      "T": 1.0,
      "consec_below_ma200": 0,
      "ma200": 475.2692
    },
    "e_target": 1.0,
    "deployed": 0,
    "gap": 1.0,
    "act": true
  },
  "tranches": [
    {
      "id": "T1",
      "status": "WAITING",
      "pct": 0.25,
      "triggers": [
        {
          "name": "event-branch discretion (TSMC print)",
          "pass": false
        }
      ],
      "pnl": null
    },
    {
      "id": "T2",
      "status": "ARMED",
      "pct": 0.2,
      "triggers": [
        {
          "name": "rv20 < 0.65",
          "pass": true
        },
        {
          "name": "id20 > -0.03",
          "pass": true
        }
      ],
      "pnl": null
    },
    {
      "id": "T3",
      "status": "WAITING",
      "pct": null,
      "triggers": [
        {
          "name": "gauntlet_cleared",
          "pass": false
        },
        {
          "name": "trend gate T >= 0.5",
          "pass": true
        },
        {
          "name": "no tripwire tripped",
          "pass": true
        }
      ],
      "pnl": null
    }
  ],
  "caps": {
    "tranche_breaches": [],
    "sleeve_pnl": null,
    "sleeve_breach": false
  },
  "vrp": {
    "iv30": 0.46,
    "iv30_asof": "2026-07-01",
    "stale": true,
    "vrp": 0.0272,
    "zone": "NEUTRAL"
  },
  "tripwires": {
    "hyperscaler_plateau": false,
    "fed_hike": false,
    "memory_rollover": false,
    "ma200_break": false,
    "any": false
  },
  "events": [
    {
      "date": "2026-07-16",
      "label": "TSMC Q2 earnings (pre-market)",
      "days_until": -105,
      "in_noadd_window": false
    },
    {
      "date": "2026-07-22",
      "label": "Alphabet Q2",
      "days_until": -99,
      "in_noadd_window": false
    },
    {
      "date": "2026-07-29",
      "label": "Microsoft + Meta Q2; FOMC day 2",
      "days_until": -92,
      "in_noadd_window": false
    },
    {
      "date": "2026-07-30",
      "label": "Amazon + Apple Q2",
      "days_until": -91,
      "in_noadd_window": false
    },
    {
      "date": "2026-08-26",
      "label": "NVDA earnings (approx \u2014 confirm)",
      "days_until": -64,
      "in_noadd_window": false
    },
    {
      "date": "2026-09-16",
      "label": "FOMC (SEP)",
      "days_until": -43,
      "in_noadd_window": false
    }
  ],
  "upstream": {
    "available": true,
    "state": "RISK_ON",
    "id20": -0.0109,
    "on20": -0.0963,
    "dist20": 4,
    "last_session": "2026-10-29"
  },
  "series": {
    "dates": [
      "2025-03-10",
      "2025-03-11",
      "2025-03-12",
      "2025-03-13",
      "2025-03-14",
      "2025-03-17",
      "2025-03-18",
      "2025-03-19",
      "2025-03-20",
      "2025-03-21",
      "2025-03-24",
      "2025-03-25",
      "2025-03-26",
      "2025-03-27",
      "2025-03-28",
      "2025-03-31",
      "2025-04-01",
      "2025-04-02",
      "2025-04-03",
      "2025-04-04",
      "2025-04-07",
      "2025-04-08",
      "2025-04-09",
      "2025-04-10",
      "2025-04-11",
      "2025-04-14",
      "2025-04-15",
      "2025-04-16",
      "2025-04-17",
      "2025-04-21",
      "2025-04-22",
      "2025-04-23",
      "2025-04-24",
      "2025-04-25",
      "2025-04-28",
      "2025-04-29",
      "2025-04-30",
      "2025-05-01",
      "2025-05-02",
      "2025-05-05",
      "2025-05-06",
      "2025-05-07",
      "2025-05-08",
      "2025-05-09",
      "2025-05-12",
      "2025-05-13",
      "2025-05-14",
      "2025-05-15",
      "2025-05-16",
      "2025-05-19",
      "2025-05-20",
      "2025-05-21",
      "2025-05-22",
      "2025-05-23",
      "2025-05-27",
      "2025-05-28",
      "2025-05-29",
      "2025-05-30",
      "2025-06-02",
      "2025-06-03",
      "2025-06-04",
      "2025-06-05",
      "2025-06-06",
      "2025-06-09",
      "2025-06-10",
      "2025-06-11",
      "2025-06-12",
      "2025-06-13",
      "2025-06-16",
      "2025-06-17",
      "2025-06-18",
      "2025-06-20",
      "2025-06-23",
      "2025-06-24",
      "2025-06-25",
      "2025-06-26",
      "2025-06-27",
      "2025-06-30",
      "2025-07-01",
      "2025-07-02",
      "2025-07-03",
      "2025-07-07",
      "2025-07-08",
      "2025-07-09",
      "2025-07-10",
      "2025-07-11",
      "2025-07-14",
      "2025-07-15",
      "2025-07-16",
      "2025-07-17",
      "2025-07-18",
      "2025-07-21",
      "2025-07-22",
      "2025-07-23",
      "2025-07-24",
      "2025-07-25",
      "2025-07-28",
      "2025-07-29",
      "2025-07-30",
      "2025-07-31",
      "2025-08-01",
      "2025-08-04",
      "2025-08-05",
      "2025-08-06",
      "2025-08-07",
      "2025-08-08",
      "2025-08-11",
      "2025-08-12",
      "2025-08-13",
      "2025-08-14",
      "2025-08-15",
      "2025-08-18",
      "2025-08-19",
      "2025-08-20",
      "2025-08-21",
      "2025-08-22",
      "2025-08-25",
      "2025-08-26",
      "2025-08-27",
      "2025-08-28",
      "2025-08-29",
      "2025-09-02",
      "2025-09-03",
      "2025-09-04",
      "2025-09-05",
      "2025-09-08",
      "2025-09-09",
      "2025-09-10",
      "2025-09-11",
      "2025-09-12",
      "2025-09-15",
      "2025-09-16",
      "2025-09-17",
      "2025-09-18",
      "2025-09-19",
      "2025-09-22",
      "2025-09-23",
      "2025-09-24",
      "2025-09-25",
      "2025-09-26",
      "2025-09-29",
      "2025-09-30",
      "2025-10-01",
      "2025-10-02",
      "2025-10-03",
      "2025-10-06",
      "2025-10-07",
      "2025-10-08",
      "2025-10-09",
      "2025-10-10",
      "2025-10-13",
      "2025-10-14",
      "2025-10-15",
      "2025-10-16",
      "2025-10-17",
      "2025-10-20",
      "2025-10-21",
      "2025-10-22",
      "2025-10-23",
      "2025-10-24",
      "2025-10-27",
      "2025-10-28",
      "2025-10-29",
      "2025-10-30",
      "2025-10-31",
      "2025-11-03",
      "2025-11-04",
      "2025-11-05",
      "2025-11-06",
      "2025-11-07",
      "2025-11-10",
      "2025-11-11",
      "2025-11-12",
      "2025-11-13",
      "2025-11-14",
      "2025-11-17",
      "2025-11-18",
      "2025-11-19",
      "2025-11-20",
      "2025-11-21",
      "2025-11-24",
      "2025-11-25",
      "2025-11-26",
      "2025-11-28",
      "2025-12-01",
      "2025-12-02",
      "2025-12-03",
      "2025-12-04",
      "2025-12-05",
      "2025-12-08",
      "2025-12-09",
      "2025-12-10",
      "2025-12-11",
      "2025-12-12",
      "2025-12-15",
      "2025-12-16",
      "2025-12-17",
      "2025-12-18",
      "2025-12-19",
      "2025-12-22",
      "2025-12-23",
      "2025-12-24",
      "2025-12-26",
      "2025-12-29",
      "2025-12-30",
      "2025-12-31",
      "2026-01-02",
      "2026-01-05",
      "2026-01-06",
      "2026-01-07",
      "2026-01-08",
      "2026-01-09",
      "2026-01-12",
      "2026-01-13",
      "2026-01-14",
      "2026-01-15",
      "2026-01-16",
      "2026-01-20",
      "2026-01-21",
      "2026-01-22",
      "2026-01-23",
      "2026-01-26",
      "2026-01-27",
      "2026-01-28",
      "2026-01-29",
      "2026-01-30",
      "2026-02-02",
      "2026-02-03",
      "2026-02-04",
      "2026-02-05",
      "2026-02-06",
      "2026-02-09",
      "2026-02-10",
      "2026-02-11",
      "2026-02-12",
      "2026-02-13",
      "2026-02-17",
      "2026-02-18",
      "2026-02-19",
      "2026-02-20",
      "2026-02-23",
      "2026-02-24",
      "2026-02-25",
      "2026-02-26",
      "2026-02-27",
      "2026-03-02",
      "2026-03-03",
      "2026-03-04",
      "2026-03-05",
      "2026-03-06",
      "2026-03-09",
      "2026-03-10",
      "2026-03-11",
      "2026-03-12",
      "2026-03-13",
      "2026-03-16",
      "2026-03-17",
      "2026-03-18",
      "2026-03-19",
      "2026-03-20",
      "2026-03-23",
      "2026-03-24",
      "2026-03-25",
      "2026-03-26",
      "2026-03-27",
      "2026-03-30",
      "2026-03-31",
      "2026-04-01",
      "2026-04-02",
      "2026-04-06",
      "2026-04-07",
      "2026-04-08",
      "2026-04-09",
      "2026-04-10",
      "2026-04-13",
      "2026-04-14",
      "2026-04-15",
      "2026-04-16",
      "2026-04-17",
      "2026-04-20",
      "2026-04-21",
      "2026-04-22",
      "2026-04-23",
      "2026-04-24",
      "2026-04-27",
      "2026-04-28",
      "2026-04-29",
      "2026-04-30",
      "2026-05-01",
      "2026-05-04",
      "2026-05-05",
      "2026-05-06",
      "2026-05-07",
      "2026-05-08",
      "2026-05-11",
      "2026-05-12",
      "2026-05-13",
      "2026-05-14",
      "2026-05-15",
      "2026-05-18",
      "2026-05-19",
      "2026-05-20",
      "2026-05-21",
      "2026-05-22",
      "2026-05-26",
      "2026-05-27",
      "2026-05-28",
      "2026-05-29",
      "2026-06-01",
      "2026-06-02",
      "2026-06-03",
      "2026-06-04",
      "2026-06-05",
      "2026-06-08",
      "2026-06-09",
      "2026-06-10",
      "2026-06-11",
      "2026-06-12",
      "2026-06-15",
      "2026-06-16",
      "2026-06-17",
      "2026-06-18",
      "2026-06-22",
      "2026-06-23",
      "2026-06-24",
      "2026-06-25",
      "2026-06-26",
      "2026-06-29",
      "2026-06-30",
      "2026-07-01",
      "2026-07-02",
      "2026-07-06",
      "2026-07-07",
      "2026-07-08",
      "2026-07-09",
      "2026-07-10",
      "2026-07-13",
      "2026-07-14",
      "2026-07-15",
      "2026-07-16",
      "2026-07-17",
      "2026-07-20",
      "2026-07-21",
      "2026-07-22",
      "2026-07-23",
      "2026-07-24",
      "2026-07-27",
      "2026-07-28",
      "2026-07-29",
      "2026-07-30",
      "2026-07-31",
      "2026-08-03",
      "2026-08-04",